Article,Date,Heading,NewsType
"STRASBOURG, FRANCE: European lawmakers on Tuesday approved an end to loathed mobile phone roaming charges in the EU by 2017 and adopted rules to ensure open internet access.""This abolition of roaming surcharges has been long awaited by everybody: ordinary people, start-ups, SMEs and all kinds of organisations,"" said Pilar del Castillo, the Spanish MEP who helped steer the legislation through the European Parliament.Roaming charges vary enormously between telecoms operators and many users have ended up paying exorbitant rates -- often without knowing in advance -- to make calls when travelling within the 28-nation European Union.Also included in the telecoms package were rules to ensure what is known as ""net neutrality,"" meaning unfettered access to the Internet, although critics said they do not go far enough.Earlier this year, the US telecoms regulator put in place ""open Internet"" rules to prevent operators offering different rates of access depending on fees or the services offered.The EU rules are largely the same but they do offer some leeway to operators to market different services. ""Thanks to this agreement, Europe will also become the only region in the world which legally guarantees open internet and net neutrality,"" del Castillo told parliament in the eastern French city of Strasbourg.""The principle of net neutrality will be applied directly in the 28 member states. It also ensures that we will not have a two-speed internet,"" she said in a parliament statement.Critics said both measures were welcome but more should be done, especially on internet access.Monique Goyens, head of the European Consumer Organisation, said that while ""access to the open Internet is now a legal right for all EU consumers ... deficiencies remain."" 










",10/27/2015,eu lawmakers end mobile roaming charg,business
"Singapore: Oil prices extended losses in Asia Tuesday on expectations of a rise in US crude inventories and following forecasts that a global supply glut will persist into next year.The US Energy Information Administration (EIA) will release Wednesday its weekly report on the country´s commercial crude inventories for the week ending October 23, which is seen as a gauge for demand in the world´s top oil consuming nation. Analysts expect another build-up.""Oil prices remain near two-month lows as oversupply issues stay in the forefront... Fundamentals re-exerted themselves,"" Bernard Aw, market strategist at IG Markets in Singapore, told AFP.""There is a belief that US inventories are on the rise, which would prolong the global glut,"" he said.""The EIA on Wednesday will provide colour to the view.""In Asia, US benchmark West Texas Intermediate (WTI) for December delivery was trading 63 cents lower at $43.35 and Brent eased 43 cents at $47.11 a barrel at around 0300 GMT.Both contracts were down on Monday after stretching losses into a second week on Friday.The losses came after Fatih Birol, executive director of the International Energy Agency, said at an energy conference in Singapore on Monday that it saw ""ample supply in the market"" until mid-2016.Prices fell to six-year lows in August but bounced back earlier this month to trade above $50, lifted by upbeat comments on the demand outlook from the head of the OPEC cartel of crude producers.The rally however was not sustained as oversupply concerns resurfaced. Current price levels are more than 50 percent below peaks of more than $100 reached in June last year.                        










",10/27/2015,oil prices retreat in asi,business
"KARACHI: The value of US dollar once again seems to be going out of control, as it climbed to Rs105.70 in the open market on Wednesday.According to sources, the greenback saw a rise in the Inter bank as well and closed at Rs105.51.Banks have been directed not to carry out transactions of dollar at lower than Rs105.50. 










",10/28/2015,dollar jumps to rs105.70 in open mar,business
"ISLAMABAD: The government is expected to ratchet up the prices of all petroleum products by a large margin with effect from November 1, sources told Geo News on Wednesday.It is expected that the price of petrol will be increased by Rs 5.35 per litre, High Speed Diesel by Rs 2.43, High Octane Blending Component (HOBC) by Rs 6.10, and kerosene oil by Rs 3.17 per litre.According to sources, Oil and Gas Regulatory Authority (OGRA) is in the process of finalising a summary which will be forwarded tomorrow. 










",10/28/2015,pol prices likely to see major hike from nov 1,business
"KARACHI: The Pakistani rupee on Wednesday slipped to a fresh two-year low of 105.80 against the US dollar in the interbank market, falling 56 paisa from its previous closing. In the open market, the rupee was down 30 paisa from Tuesday's closing, trading at 105.60 against the USD. Due to the rise in the value of the dollar by Rs 1.40 in the last two days, Pakistan's external debt is likely to see an increase of Rs 84 billion, analysts said. The recent climb of the dollar against the rupee has been attributed to a strong demand of the greenback from importers and its outflows from the country. Currency dealers say the growing demand is due to oil-related payments.""There were a few import payments in the market and banks were already short of them, and as the rupee crossed the 104.50 level it triggered 'stop', surging the rupee past the 105 figure,"" Eman Khan from Tresmark, an application that tracks financial markets, told The News on Tuesday. ""It's no coincidence that it happened on a day when the Finance minister initiated meeting with the IMF (International Monetary Fund) and also when economic managers are assessing the damage from the deadly earthquake,"" Khan said. The talks between the IMF officials and the Pakistan's authorities on the ninth review of the extended fund facility program started on Monday in Dubai. Despite strong foreign exchange reserves and narrowing current account deficit, the rupee is constantly losing its value. The rupee depreciated 3.5 percent since the beginning of the current fiscal year.                        










",10/28/2015,rupee sinks to fresh two year low against dollar,business
"Singapore: Oil prices tumbled in Asia Thursday, cutting short a rally the day before after hints of an interest rate hike in December by the US Federal Reserve boosted the dollar.Prices rose Wednesday after the US Department of Energy said the country´s commercial crude stockpiles had increased less than expected, suggesting stronger demand in the world´s top oil consuming nation.But the rebound was punctured after the Fed on Wednesday signalled it could raise rates before the end of the year, expressing optimism for the world´s top economy after ""solid"" consumer spending and business investment.""With the Federal Reserve holding off on interest rates hikes on Wednesday, the market will keep watch on the December meeting where a rate hike is likely in play,"" said Sanjeev Gupta, head of the Asia Pacific oil and gas practice at professional services firm EY.At around 0330 GMT, US benchmark West Texas Intermediate for delivery in December was trading 16 cents lower at $45.78 and Brent crude for December was down 21 cents at $48.84.US oil prices jumped more than six percent in Wednesday´s session after news domestic crude supplies rose less than expected in the week ending October 23.The news helped ease some fears over a glut of world supplies that experts warn could last well into next year, which has seen oil prices more than halve from last year´s highs.But the rally was cut short when the US central bank explicitly pointed to the possibility of a rate hike in its next meeting in December, dampening market predictions it could be held off until March.The news pushed the dollar higher -- an interest rate hike is bullish for the dollar as it attracts investors to the currency in the quest for higher returns.But because oil is traded in dollars, a strong US currency will make the commodity more expensive for holders of weaker units, hurting demand and prices.""We are still expecting the Fed rate normalisation to be an eventuality and the latest Federal Open Market Committee decision further reaffirms our expectation for the first hike (since 2006) to take place in the 15-16 December 2015 FOMC (meeting),"" United Overseas Bank said. 










",10/29/2015,oil rally fizzles as fed rate hike comments boost dollar,business
"KARACHI, October 30, 2015 - Advance Telecom will offer iPhone 6s and iPhone 6s Plus beginning on Friday 13th November 2015.According to a press release, the interested customers can avail the offers at 5 Futuretech and 11 Advance Stores across Pakistan. It further said that amazing offers can be availed by booking the devices on futuretech.pk starting 31st October 2015. People can visit the stores and become a part of this launch in Karachi, Lahore & Islamabad. 










",11/1/2015,futuretech brings iphone 6s iphone 6s plus to paki,business
"ISLAMABAD: Liquefied Petroleum Gas marketing companies have increased price of LPG by Rs 8 per kg following increase in import duty and its demand.Chairman LPG Distributions Association, Irfan Khokhar said price of domestic cylinder is hiked by Rs 100 and commercial cylinder by Rs 400.Khokhar said the new price of LPG in Karachi would be Rs 85 per kg with domestic cylinder at Rs970. In Lahore and Peshawar the price of LPG had been raised to Rs 90 per kg with domestic cylinder at Rs 1030 while in AJK Rawalpindi and Islamabad of LPG would available at Rs100 per kg with domestic cylinder at Rs 1150.In Northern area, the price has climbed to Rs120 per kg.He demanded of the government to abolish duties and taxes on import of LPG in order to encourage more its import for meeting local demand.                        










",11/2/2015,lpg price up by rs 8 per kg,business
"Tokyo: Asian stocks dipped in early trade Monday, while the dollar retreated against most regional currencies as a weak reading in a Chinese manufacturing index stirred worries about the world´s number two economy.On equity markets, there were losses across the board as Sunday data showed activity in China´s vast manufacturing sector declined in October for the third straight month, triggering worries about the Chinese economy, a crucial driver of global growth.Investors also turned to profit taking after equity markets surged last month, recovering from their worst quarter in four years during July-September, as analysts said fresh cues were needed for markets to rally further.China´s Purchasing Managers´ Index (PMI), tracking activity in the factory and workshop sector, was unchanged from the previous month at 49.8, the state statistics office said Sunday.A PMI figure above 50 signals expanding activity while anything below indicates shrinkage.""I´m struggling to see catalysts to encourage the market to take this rally to the next level,"" said Tony Farnham, a strategist at Patersons Securities Ltd.""China´s PMI numbers were underwhelming. Manufacturing will probably remain weak as China tries to rebalance its economy away from manufacturing and into services.""Tokyo was down 1.87 percent by the lunch break on the weak figures, Hong Kong fell 0.60 percent in early trade and Shanghai dropped 0.38 percent. Sydney lost 1.26 percent as oil halted a three-day climb, while Seoul edged up 0.17 percent after a drop in South Korean exports.On Wall Street Friday, the Dow fell 0.52 percent, the S&P 500 lost 0.48 percent and the Nasdaq dropped 0.40 percent.- Dollar retreats -The dollar remained under selling pressure against emerging currencies and the yen early Monday, after stagnant US economic indicators bolstered the argument against a December rate hike.The US government said Friday its consumer spending rose only by 0.1 percent in the United States in September, less than expected and the slowest rate since January.While the US Federal Reserve said earlier this year it expected to tighten monetary policy before 2016, the summer´s turmoil on global markets and a slowdown in the world economy have forced policymakers to stay their hand.""Tokyo has taken over the dollar-selling sentiment from New York,"" Minori Uchida, head of Tokyo global markets research at Bank of Tokyo-Mitsubishi UFJ, told AFP.""It is difficult to buy the dollar now as the recent economic figures are not strong enough to justify a rate hike,"" Uchida said.Many economists now are tipping a lift-off early in the new year, bolstering emerging market currencies, which had been hammered this year on talk of a 2015 move as investors remove their cash to the United States in search of better, safer returns.In early trade on Monday, the Malaysian ringgit added 0.21 percent against the dollar, while the Indonesian rupiah advanced 0.20 percent, the Singapore dollar rose 0.07 percent, Taiwan´s dollar gained 0.35 percent and the Thai baht was 0.14 percent higher.The greenback bought 120.40 yen from 120.67 yen Friday in New York. The euro was at $1.1032 and 132.83 yen from $1.1003 and 132.77 yen in US trade.                        










",11/2/2015,asian stocks dollar retreat on weak chinese manufacturing d,business
"Singapore: Oil prices rebounded in Asia Tuesday, buoyed by bargain hunting ahead of the release of US government data that will gauge crude demand in the world´s biggest economy.Analysts expect the data to be released Wednesday by the US Energy Department to show that commercial crude stockpiles rose in the week to October 30 which typically means weaker demand in the world´s top oil consuming nation.Despite occasional rallies, oil remains generally bogged down by a global crude supply glut that has outpaced demand and depressed prices for more than a year.""Expectations of more US stockpiles restrained oil bulls,"" said Bernard Aw, market strategist at IG Markets in Singapore.A global economic slowdown led by China has hammered demand for the commodity and highlighted worries that there may not be enough economic activity to soak up excess supplies as output levels from oil producing nations remain high.China´s official purchasing managers index for the manufacturing sector showed activity shrank in October for the third straight month.Russian oil production broke a post-Soviet record in October, climbing to 10.78 million barrels per day, according to Bloomberg News.At around 0310 GMT Tuesday, US benchmark West Texas Intermediate for delivery in December was up 16 cents at $46.30 and Brent crude for December was trading 11 cents higher at $48.90 a barrel.Prices dipped on Monday after data showed China´s manufacturing output continued to contract and Russian oil production hit a new record high.Current price levels are more than 50 percent lower from their peaks in June 2014 when a barrel of oil was selling at over $100. 










",11/3/2015,oil prices up in asia ahead of us crude inventories repor,business
"Singapore: Oil prices were flat in Asia Wednesday as investors weighed US petroleum industry data showing a build-up in crude stockpiles and news that shipments from a Libyan port were halted due to tensions.US benchmark West Texas Intermediate for delivery in December was down one cent at $47.89 and Brent crude for December was trading two cents higher at $50.56 at around 0315 GMT.The industry-funded American Petroleum Institute said US crude inventories rose by 2.8 million barrels in the week to October 30, according to Bloomberg News.The industry report comes ahead of the release later Wednesday of the official US Energy Department of Energy data on commercial crude stockpiles which is also expected to show an increase.A build in the stockpiles indicates softer demand in the world´s top oil consumer and is negative for prices.Libya´s Petroleum Facilities Guard meanwhile halted crude shipments from Zueitina port indefinitely due to the widening conflict between the strife-torn nation´s rival governments, Bloomberg News said.Tankers seeking to load crude at the port must register with the National Oil Corp. administration loyal to the internationally recognised government in the country´s eastern region, Bloomberg quoted Petroleum Guard spokesman Ali al-Hasy as saying.""Supply is still the story,"" Jonathan Barratt, chief investment officer at Ayers Alliance Securities in Sydney, told Bloomberg.""Geopolitical issues will always put a base under prices and there is a solid range for oil.""Oil prices have fallen by more than half from peaks of over $100 a barrel in June last year.A global economic slowdown led by top energy guzzler China has led to demand not keeping pace with the crude supply glut which is expected to persist well into next year.                        










",11/4/2015,oil prices flat in asia on us data and supply concer,business
"ISLAMABAD: Pakistan is set to receive the 10th tranche of 550 million dollars from International Monetary Fund (IMF) next month under Extended Fund Facility (EFF) arrangement.Finance Minister, Ishaq Dar made the announcement on Thursday while addressing a press conference along with IMF mission head, Herald Finger here.He said the next installment of loan assistance will be received in the mid of December after the approval from IMF’s administration and Executive Board.Ishaq Dar said Pakistan has achieved all the economic targets while work is in progress towards improving tax collection and keeping the budget deficit under control.He did mention steps aimed to achieve the tax collection target but stopped short of elaborating on them.The Finance Minister also announced that Pakistan will receive 900 million dollars from the World Band and Asian Development Bank in the current month of November.                        










",11/5/2015,pakistan to receive 10th imf loan tranche in d,business
"Tokyo: The dollar held steady in Asia Thursday after US central bank chief Janet Yellen suggested that a December US interest rate lift-off was still on the table.In congressional testimony, Yellen said that if the world´s top economy was ""performing well"" and, if conditions warrant, a rate hike in December ""would be a live possibility"".Yellen´s remarks came ahead of Friday´s release of a key US jobs report for October and as fresh data on the vast US services sector Wednesday supported the view that the economy was on the upswing.""Solid US data and Yellen´s comments that seemed to support a rate hike next month sparked dollar buying,"" Naohiro Nomoto, an economist at Bank of Tokyo- Mitsubishi UFJ, told Bloomberg News.""The dollar is being bought gradually, with markets pricing in the rate increase as data come out and yields rise. Fed officials appear to be setting up for the move.""Yellen´s comments took a bite out of some Asian currencies Thursday with the Malaysian ringgit, the South Korean won and the Indonesian rupiah among the units falling against the greenback Thursday.But the dollar ticked lower against the yen, edging down to 121.50 yen from 121.55 Wednesday in New York, after trading in New York at its highest level since August on Yellen´s comments. High-yield, riskier emerging currencies have been hit hard this year on fears of a flight of capital back to the United States as dealers look for better, safer investments on the back of the looming US rate lift-off.The greenback has suffered a heavy sell-off against the Asian emerging units in recent weeks, however, as the Federal Reserve stood pat on raising interest rates at its October policy meeting.In other deals, the euro was nearly flat from US trade at $1.0866 and 132.02 yen compared to $1.0865 and 132.06 yen. 










",11/5/2015,dollar steady as fed chief keeps december rate rise in play,business
"London: The oil market rose on Friday but gains were limited by the global supply glut and after the US Federal Reserve hinted at a December interest rate hike.In midday deals in London, Brent North Sea crude for December won 44 cents to stand at $48.42 per barrel.US benchmark West Texas Intermediate for delivery in December rose 26 cents to $45.46 per barrel compared with Thursday´s close. Despite the slender gains, prices are lower compared with the previous week as the market struggles with a crude oversupply and weak demand owing to sluggish global growth led by top energy guzzler China.Increasing talk of an interest rate hike by the US Federal Reserve has also bolstered the dollar, making dollar-priced oil more expensive for weaker currencies, hurting demand and prices.A meeting last month of the policy-setting Federal Open Market Committee (FOMC) hinted that a decision to implement the first rate hike since 2006 could be made during a December meeting.Comments this week by Fed chair Janet Yellen and New York Fed president Bill Dudley considered as ""hawkish"" by the market have firmed up expectations for the December FOMC meeting ""as a live possibility for the first Fed rate hike in nearly a decade,"" Singapore´s United Overseas Bank said.Markets are watching the US non-farm payrolls data to be released later Friday for further signs about the health of the US economy which could help swing any decision on interest rates, it said.The data is a closely watched gauge of the unemployment situation in the world´s biggest economy and top oil consuming nation.Oil prices have plunged by more than half from peaks of over $100 a barrel in June last year.The International Monetary Fund has projected slower growth for the world economy this year and next. 










",11/6/2015,oil prices adv,business
"DOHA: Pakistan has finalised a 15-year, $16 billion liquefied natural gas (LNG) deal with supplier Qatar and shipments are expected to begin next month, Pakistan Minister for Petroleum and Natural Resources Shahid Khaqan Abbasi said on Monday.The amount is 1.5 million tonnes per year, the minister told news agency Reuters on the sidelines of an Asian ministerial energy roundtable in the Qatari capital Doha.The two sides have agreed a price, he said without elaborating.""We have finalised the deal. The first shipment is expected in December,"" he said. ""We are hopeful for similar deals in the future.                        










",11/10/2015,pakistan finalises 15 year 16bn lng deal with qatar,business
"LIMASSOL: Moody’s Investors Service on Wednesday changed the outlook for the Pakistan banking system to stable from negative, reflecting the improvement in the country’s economic growth prospects, driven in turn by the government’s commitment to economic reforms under its IMF program.“We expect the strengthening economy, together with the central bank’s accommodative monetary policy, to stimulate lending growth and support the banking sector’s loan performance over the next 12-18 months,"" said Elena Panayiotou, a Moody’s Assistant Vice President and lead analyst for Pakistani banks.Moody’s forecasts Pakistan’s real GDP will expand by 4.0 per cent in the fiscal year ending June 2016 (compared to a sluggish 2.8pc during 2008-13), mainly driven by higher spending on infrastructure projects as the government aims to ease energy shortages and execute projects associated with the China-Pakistan Economic Corridor (CPEC).The rating agency noted that the strengthening of the domestic economy will contribute to the improvement in Pakistani banks’ asset quality. The level of credit risk, however, will remain high as banks are heavily exposed to the low-rated Pakistan sovereign (B3, stable) through holdings of securities and government-related loans, which were equivalent in size to 7.3x Tier 1 capital, exposing banks to event risk.""We expect problem loans will decline to around 12 per cent of total loans by the end of 2016 compared with 12.4pc for the end of June 2015. Banks, however, will remain heavily exposed to the low-rated Pakistan sovereign, linking the banks’ creditworthiness to that of the sovereign"" Panayiotou said.In the area of capital, the rating agency expected that buffers will come under pressure due to moderate asset growth and lower internal capital generation – a result of weaker profitability.Moody’s expected earnings to ease slightly over the outlook period, mainly because of the lower coupon on government securities in a declining interest rate environment and as the market’s perception of Pakistan’s risk profile eases (upgraded to B3 from Caa1 on June 11, 2015). Higher loan volumes and capital gains booked through the sale of government securities will only partially offset the pressure on profitability.In addition, the rating agency expected that Pakistani banks will maintain ample liquidity and continue to benefit from large volumes of low-cost and stable customer deposits.""The Pakistani banks’ deposit-based funding structure remains a credit strength. We expect inflows of remittances from migrant workers will continue to drive the growth in bank deposits and support banks’ funding bases,"" said the asst vice-president of Moody's.While banks will use part of their liquid asset to fund lending, Moody’s expected the sector to maintain strong liquidity buffers, with core liquid assets – defined as cash and bank placements – at 12 per cent of total assets and liquid securities, more broadly defined, at 41pc of total assets as of June 2015.                        










",11/11/2015,moodys ups pakistan banking system outlook to stab,business
