Article,Date,Heading,NewsType
"MELBOURNE: Second seed Andy Murray had his feathers ruffled but scrapped his way into the Australian Open quarter-finals with a 6-4 6-4 7-6(4) victory over local hope Bernard Tomic on Monday.The Briton, four-times a runner-up at Melbourne Park, was close to exasperation after being broken four times by the unorthodox Australian world number 17 but dug deep when it mattered to reach the last eight for the seventh year in a row.Murray had endured a tricky couple of days since Nigel Sears, the father of his pregnant wife Kim, collapsed in the stands on Rod Laver Arena and was taken to hospital while the Scot was playing his third round tie on Margaret Court Arena.As Sears, the coach of Ana Ivanovic, has since been discharged and cleared to join his daughter in England, Murray hoped he would have a calmer preparation for his quarter-final encounter with Spanish eighth seed David Ferrer.Murray, 28, enjoyed success with the drop shot early in the match but that started to wane in a match that was always interesting if never turning into a real contest.Tomic, 23, showed flashes of the quality that has had Australia raving about his potential since his early teens but was unable to maintain the level of his performance for sufficiently long periods to cause an upset.Murray, who fired 18 aces and 43 winners, clinched a topsy turvy third set in the tiebreak when Tomic went long with a return after two and a half hours on court.""I just felt I was very uncomfortable,"" Tomic, who dropped serve three times in the first set, said.""While on paper it looked like a close match it was uncomfortable for me.<br/> I didn´t play the game the way I wanted to but he didn´t let me.""After Johanna Konta earlier earned her place in the quarter-finals, Murray´s victory means Britain will have a presence in the last eight of both draws of a grand slam for the first time since the 1977 Australian Open.Murray has his eye firmly fixed on becoming Britain´s first men´s champion in Australia since Fred Perry in 1934 but he must get past Ferrer to do it. (Reuters)  ",1/25/2016,Murray downs Tomic to reach Melbourne quarter fi,sports
"PRETORIA: A patient century stand between Hashim Amla and Temba Bavuma put South Africa in a commanding position at 223 for four at tea on day four of the final Test against England on Monday.Amla, a regular thorn in England´s side, was not out on 96 as he chases a second century in the match with Bavuma unbeaten on 63. The hosts led by 356 runs on a pitch that has turn, movement and uneven bounce.The pair have put on 117 for the fifth wicket and kept England wicketless between lunch and tea after the touring side had made good inroads in the opening session when a fired-up James Anderson grabbed two early wickets and Ben Stokes another.South Africa, who are likely to be down to three front-line bowlers in the second innings with seamer Kyle Abbott struggling due to a hamstring problem, must decide what target they want to set England with four sessions remaining.They will be mindful of overworking their depleted attack as they chase a consolation victory in the test with England already having claimed the series.The previous highest chase successful in Test matches at Centurion Park was 251 by England in 2000, though the pitch was only used for two days in that match after rain spoiled the contest and the teams decided to forfeit an innings each to force a result.Anderson had earlier taken his number of test wickets to 433, one short of Indian great Kapil Dev in sixth place on the all-time list.He first induced a rash drive from opener Stephen Cook (25) that provided a catch for wicketkeeper Jonny Bairstow and two balls later grabbed the big scalp of home captain AB de Villiers, lbw without scoring.It was the third duck in a row for De Villiers, comfortably his worst run of form in Test cricket since he made his debut in 2004.Stokes removed JP Duminy (29) caught behind by Bairstow to leave South Africa sweating at 106 for four, before Amla and Bavuma edged the home side ahead again. (Reuters)  ",1/25/2016,Amla Bavuma put South Africa in driving ,sports
"PRETORIA: England´s nemesis Hashim Amla overcame a battered thumb and a lively wicket to post 50 not out and guide South Africa to 121 for four at lunch on day four of the final Test on Monday.The Proteas led by 254 runs on a rapidly deteriorating wicket with Amla and Temba Bavuma (nine not out) seeking to set England a record-breaking target if they are to win the series 3-0.The touring side bowled well in the morning session, with James Anderson grabbing two early wickets and Ben Stokes another.They have yet to dismiss Amla, though, as he showed great patience and steel while in obvious discomfort after being wrapped on the glove by Stokes on day three.He took his series runs tally to 424 at an average of 70.66 and remains the key in the Proteas posting a fourth-innings target they will feel is beyond England.Anderson had earlier taken his number of Test wickets to 433, one short of Indian great Kapil Dev in sixth place on the all-time list.He first induced a rash drive from opener Stephen Cook (25) that provided a catch for wicketkeeper Jonny Bairstow and two balls later grabbed the big scalp of home captain AB de Villiers, lbw for a duck.It would have been a satisfying moment for Anderson after De Villiers had suggested before the game that England´s bowlers had lost pace, with many suggesting he was alluding specifically to Anderson.It was also the third duck in a row for De Villiers, comfortably his worst run of form in test cricket since he made his debut in 2004.South Africa still have first-innings centurion Quinton de Kock to bat before England are in to the tail, but chasing anything over 300 on a wicket with variable bounce and movement will be extremely difficult.It would also be a record, the previous highest chase in test matches on this ground was 251 by England in 2000, though the pitch was only used for two days in that match after rain spoiled the test and the teams decided to forfeit an innings each to force a result. (Reuters) ",1/25/2016,Injured Amla stands firm as South Africa build lead,sports
"WELLINGTON: New Zealand defeated Pakistan by 70 runs in first one-day international of three-match series here on Monday.</strongBatting first, after Pakistan skipper Azhar Ali won the toss and decided to field, Kiwis set 281 runs target for the Green Shirts. New Zealand made 280 for eight. Henry Nicholls made highest 82.Pakistan’s Mohammad Amir took three wickets for 28 runs.In reply to 280, Pakistan were all out for 210. Babar Azam scored 62.New Zealand pacemen Trent Boult and Grant Elliott shared seven wickets as the hosts bundled out Pakistan for 210Elliott did the early damage while Boult, the world´s top-ranked ODI bowler, ran through Pakistan´s lower order as the touring side were shot out in 46 overs, chasing a target of 281 in the first of the three-match series.Pakistan lose their last seven wickets for 68 runsNew Zealand led the three-match series 1-0. The second match of the series will be played in Napier on Thursday.",1/25/2016,Kiwis set 281 runs target for Pakistan in first ODI,sports
"WELLINGTON: Pakistan won toss and invited New Zealand to bat in the first ODI of the three-match series here on Monday.Pakistan skipper Azhar Ali said his bowlers will try to get early wickets and enter the field with a thorough team plan. Badly battered in the earlier T20s, Pakistani cricketers have worked hard inside the practice nets to get themselves a good start in the ODI series. In the first of the three-ODI series, Ahmed Shahzad, Suhaib Maqsood and Anwar Ali have been included in the team whose other players are Azhar Ali, Muhammad Hafeez, Babar Azam, Sarfaraz Ahmed, Anwar Ali, Muhammad Irfan, Wahab Riaz, Ammad Waseem and Muhammad Amir will be part of the Pakistan team. Muhammad Amir is playing his first ODI after remaining outside the field for five-years. After winning the toss, Azhar Ali said it would be challenging for him as a captain to play in New Zealand. However, he said, his team’s spirits are high to win.",1/25/2016,Pakistan wins toss invite New Zealand to bat in firs ODI,sports
"LAHORE: Pakistan’s T20 captain, Shahid Afridi is satisfied with his own performance in the series against New Zealand but unhappy with that of the team’s.Afridi admitted that his team’s performance was not up to the mark in the New Zealand T20 and ODI series, adding he would take up the issue with the management.He said the team is going through a tough phase but added that it would continue to move forward by taking it as a challenge.“Our performance was not up to the mark….it is not Squash in which everything depends on the performance of a single player. The whole team has to perform (in Cricket),” he lamented.He came down hard on Ahmed Shahzad and Umer Akmal, saying attitudes will have to be mended to keep a certain status in the team.“Attention will have to be focused on the game,” he said, adding only a lucky few get so many chances.Afridi said he supported Ahmed Shahzad and Umer Akmal as much as possible, warning if they want to stay in the team, both will have to perform with consistency.",1/26/2016,Shahid Afridi unhappy with teams perfor,sports
"MELBOURNE: Tennis star Sania Mirza teamed up with Croatian partner to beat Aisam ul Haq’s pair in the mixed doubles at Australian Open here on Tuesday.In the Grand Slam’s second round of mixed doubles Pakistan and India came face-to-face as Aisam ul Haq took on Sania Mirza.In the first set, Aisam along with his female tennis partner from Kazakhstan Yaroslava Shvedova competed well against the pair on the other side but ended up losing with 5-9.Sania Mirza and her Croatian partner Ivan Dodig dominated the second set and inflicted a crushing defeat to Aisam’s pair with 6-2.",1/26/2016,Australian Open Sania Mirzas pair defeats Asiams in mixed doub,sports
"MELBOURNE: Roger Federer advanced to his 12th Australian Open semi-final on Tuesday with an efficient 7-6(4) 6-2 6-4 victory over sixth seed Tomas Berdych.</strongFederer was pressed hard in the opening set, taking it in a tie-break after swapping service breaks with Berdych, before the Swiss won the important points in the second set to take control of the match.The Czech broke early in the third set before 17-times grand slam winner Federer broke back in the third game and upped the pressure on his 30-year-old opponent, breaking again in the ninth then serving out to seal it in two hours, 16 minutes.Federer now waits the winner of the quarter-final between world number one Novak Djokovic and Japan´s Kei Nishikori, who play later on Rod Laver Arena.",1/26/2016,Federer through to semis with efficient win over Berdy,sports
"MELBOURNE: Reigning champion Serena Williams ramped up the power in the second set to vanquish fifth seed Maria Sharapova for the 18th match in a row and reach the semi-finals of the Australian Open with a 6-4 6-1 victory on Tuesday.</strongSharapova broke the world number one in the first game and mounted a stiff challenge in the opening set but wilted in the second to extend a losing record that goes back 12 years.Williams said the Russian brings out the best in her.""When I play her, I know automatically I have to step up my game,"" Williams said. ""I think that makes me play better. When I'm forced to play better, I do well.""The gulf between Williams and Sharapova, a former number one and five-times grand slam champion, speaks volumes about the balance of power in the women's game.Williams has reached the last four at Melbourne Park on six previous occasions and gone on to win the title every time.On Tuesday's evidence, it looks like only illness or injury can prevent the 34-year-old from repeating the feat and adding a 22nd major title to her collection.The American, who came into the tournament after a four-month layoff, twice had treatment for ""food poisoning issues"" during breaks in the 92-minute rematch of last year's final.Sharapova handed back her early break with two double faults in game four but started the match well and offered a genuine test in the 55-minute opening stanza.The Russian showed character to storm back from 0-40 down to hold serve for 4-4 and was all over Williams's serve in the next game, the American yelling ""C'mon!"" on successive points as she finally held.The match turned on the next game when Sharapova fended off three set points despite failing to get her first serve in before Williams converted the fourth after a long rally with a volley at the net.Sharapova had fired 21 aces in her fourth round match but managed just seven against Williams.""I think if you're serving maybe 180 (kph) against somebody else compared to Serena, that's an ace,"" said the 28-year-old.""Against Serena, as we all know, the return is one of her great strengths. She's very explosive. She stays quite close to the baseline.""She cuts the ball early. She doesn't give you many angles.""Williams has an 8-0 record against her semi-final opponent Agnieszka Radwanska, who as the fourth seed is the highest ranked challenger remaining in the draw.""Nothing's guaranteed in sports,"" said Williams. ""I still have to win two matches against potentially two extremely tough opponents.""",1/26/2016,Serena beats Sharapova to reach semi fi,sports
"New Zealand Cricket on Wednesday apologized to Pakistan fast-bowler Mohammad Amir after a stadium announcer played the sound effect of a cash register just before the left-arm pacer was about to start one of his overs.NZC said it was ""inappropriate and disrespectful"" of the DJ to have played the suggestive sound effect during Friday's third T20 International between Pakistan and New Zealand at the Westpac Stadium in Wellington.According to reports, NZC chief executive David White has reprimanded the DJ and offered a full apology to Amir and the Pakistan team.""I think playing the sound effect was inappropriate and disrespectful, and has the effect of trivialising one of the biggest issues facing cricket at the moment,"" White told a local newspaper.""I've contacted the Pakistan team management to apologise, and to assure them there will be no repeat.""Amir recently returned to cricket after a five-year ban for spot-fixing and is on his first international tour since his suspension ended.",1/27/2016,NZ Cricket apologises to Amir for a tau,sports
"MELBOURNE: Johanna Konta ground down Chinese qualifier Zhang Shuai 6-4 6-1 at the Australian Open on Wednesday to become the first British woman to reach the semi-finals of a grand slam in over 30 years.Hours later, Andy Murray capped a banner day for Britain as he reached the semi-finals of the men´s tournament with a four-set victory over David Ferrer.Murray´s win ensured Britain have two representatives in the last four of a grand slam for the first time since 1977.The 47th-ranked Konta will seek to continue her fairytale run on Thursday when she meets German seventh seed Angelique Kerber for a place in the title-decider.Konta´s rise has been little short of extraordinary, with her last trip to Melbourne Park cut short with a humbling exit at qualifying when ranked 147th in the world.Twelve months on, the Sydney-born 24-year-old has emulated Eugenie Bouchard´s breathtaking run at the 2014 tournament by reaching the last four on her main draw debut at Melbourne Park.The last British woman to make a grand slam semi-final was Jo Durie at the 1983 U.S.Open, while the last finalist was the 1977 Wimbledon champion Virginia Wade.Konta will bid to become the first British woman to reach the Australian Open final since Wade´s run to the 1972 title.Although Konta has reached lofty heights for British tennis, the quarter-final against Zhang failed to soar quite so high.Both players battled nerves and the Chinese qualifier came into the match fatigued after playing seven straight matches.Konta steadied first and rushed to a 5-2 lead before an attack of nerves nearly brought her undone.The Eastbourne resident crumbled with two double-faults when serving for the set and allowed Zhang to claw back to 5-4.As the first woman qualifier to reach the quarter-finals at Melbourne Park in nearly three decades, Zhang was never going to concede lightly.She saved five set points in an epic game before Konta ended the argument with a pair of booming first serves.The pair traded service breaks early in the second set before Konta roared to a 5-1 lead.Although struggling to muster the energy, Zhang battled to the end, saving two match points.But she was powerless to save the third when Konta hammered a shot into an obliging net-cord that gave the Chinese no chance. (Reuters) ",1/27/2016,Konta reaches Australian Open semis for first ti,sports
"MELBOURNE: Champion Novak Djokovic foiled a stirring fightback from Roger Federer to defeat the Swiss 6-1 6-2 3-6 6-3 at the Australian Open on Thursday and charge into a fifth successive grand slam final.</strongStorming to a two-set lead within an hour, Djokovic appeared destined to complete a stinging humiliation but the net-rushing Federer responded brilliantly in the third as a partisan crowd roared him on at a flood-lit Rod Laver Arena.In a fourth set rivened by tension, Djokovic broke Federer in the eighth game and served out the match to love in two hours and 19 minutes.The world number one will bid for a record sixth title at Melbourne Park in the professional era, and will meet the winner of second seed Andy Murray and 13th seed Milos Raonic who play in the second semi-final on Friday.",1/28/2016,Djokovic puts down Federer fightback to reach fi,sports
"MELBOURNE: Serena Williams underlined the difference in class and power between her and the rest of the women's field with a 6-0 6-4 demolition of fourth seed Agnieszka Radwanska on Thursday to reach her seventh Australian Open final.</strongEvery time the American has made the final at Melbourne Park she has gone on to win the Daphne Akhurst Memorial Cup.Victory in Saturday's final against either seventh seed Angelique Kerber or unseeded Briton Johanna Konta, would give her a 22nd grand slam title, moving her to a tie with Steffi Graf for the most in the Open era.Williams romped through the first set in just 20 minutes before Radwanska showed some fight in the second but she was unable to stop the momentum of the American, who clinched her place in the final in 64 minutes.""I'm really excited to be in another final. It blows my mind right now,"" Williams said in a courtside interview. ""I just feel like I'm being the best I can and I can't believe I'm in another final.""She started really well in the second set and making some great shots and hitting it deep and I just thought that I had to be aggressive.""Williams began in ominous fashion breaking the Pole's serve in the first game with Radwanska's lack of power highlighted by the blistering nature of the American's returns.Radwanska's fastest serve in the first game reached just 140 kph. Williams was returning the ball at over 130.The fourth seed appeared resigned to defeat in the first set by the fourth game. She barely got a backhand return to a Williams serve then stood, with slumping shoulders, and watched as the 34-year-old put the overhead smash away.Williams cleaned up the first set in just 20 minutes before Radwanska elicited the largest cheer of the match at that time when she held serve in the first game of the second set, avoiding an embarrassing potential 'double bagel' 6-0 6-0 score.The crowd on Rod Laver Arena, which had its roof closed due to heavy rain in Melbourne, however managed to almost open it in the sixth game with a decibel-rising roar of support for Radwanska when she broke Williams to level it at 3-3. Williams, however, broke again in the ninth game and then served out with three aces to seal a match in which she belted 42 winners to Radwanska's four.Radwanska, who had been bidding to reach her second grand slam final after Wimbledon in 2012, also heavily lost her only other semi-final appearance at Melbourne Park when she was beaten 6-1 6-2 by Dominika Cibulkova in 2014.",1/28/2016,Serena demolishes Radwanska to make final in Australi,sports
"Napier: The second one-day international between Pakistan and New Zealand in Napier was abandoned without a ball being bowled due to heavy rain and a wet outfield on Thursday.</strongThe calling off means Pakistan, who lost Monday´s first one-dayer by 70 runs, can now only hope to level the series when the teams play the third and final match at Auckland on Sunday.Heavy rain rendered the outfield too wet for any play and the umpires finally decided to call off the match after several inspections through the day.New Zealand had earlier won the three-match Twenty20 international series 2-1.",1/28/2016,Pakistan Kiwis 2nd ODI washed out in Napier,sports
"MELBOURNE: Andy Murray went through paroxysms of frustration but seized another opportunity to break his Australian Open jinx with a four-hour, five-set semi-final victory over Milos Raonic on Friday.Four times the British world number two has advanced to the final at Melbourne Park and four times he has been vanquished, three times at the hands of Novak Djokovic.The Serbian will again stand in his path on Sunday as the Scot seeks to add another grand slam title to his 2012 U.S. Open and 2013 Wimbledon crowns.Raonic, meanwhile, was left heartbroken after suffering a thigh injury that hampered him from the middle of the third set of the 4-6 7-5 6-7(4) 6-4 6-2 defeat.Winning tennis matches never looks like a walk in the park for Murray but for much of the contest against the Canadian, he at least had some justification for the tortured grimaces and explosions of anger that followed every setback.The 13th seed has been on fire this year and his big serve and huge forehands had one of the best returners in the game on the ropes, while his new-found net game helped him to a healthy 72 winners.Murray said earlier this week that he would waste no more energy on the histrionics but the match was just minutes old when he returned to his chair muttering curses having been broken to love in his first service game.That was to be Raonic´s only break of the match but it was enough to win the first set and, after Murray had pounced to even up the contest, he ramped up his 230 kilometre-per-hour serve to clinch the third on tiebreak.The 25-year-old Raonic, hoping to become the first Canadian man to reach a grand slam final, was feeling the injury in the fourth set but Murray had also crucially got a better fix on his serve and broke for 4-3.Raonic almost claimed it back in the next game but Murray saved two break points, falling to one knee and roaring ""Yes! Yes!"" as he pumped his fist at the ground.Murray served out the set to even up the contest again and grabbed two breaks early in the decider as the wincing Raonic´s level dropped, the Canadian´s racket feeling the brunt of his frustration after the first.Murray finished off his ailing opponent with a sublime crosscourt backhand volley to bring up a match point, which he converted with a handsome forehand winner.The 28-year-old pointed both index fingers at the roof of Rod Laver Arena before slumping into his courtside chair with a look of relief on his face.The relief will not be long-lived, however, as he will be back on the same court on Sunday attempting to dethrone five-times champion Djokovic.Murray´s older brother Jamie will be bidding for silverware on Saturday when he teams up with Bruno Soares to take on Daniel Nestor and Radek Stepanek in the men´s doubles final.It is the first time two brothers have reached separate finals at the same grand slam.<br/> ""You´re not going to see it very often,"" Murray junior said. (Reuters) ",1/29/2016,Tortured Murray outlasts Raonic to reach Melbourne fi,sports
"JOHANNESBURG: AB de Villiers has been appointed as the full-time captain of South Africa´s Test team, ending speculation he could retire from the longest format of the game to ease his workload.Cricket South Africa made the announcement on Friday after De Villiers was appointed for the final two Tests of the recently completed series against England on a temporary basis following the resignation of Hashim Amla.De Villiers, also captain of the one-day international side who take on England in a five-match series starting on Wednesday, believes his team can regain their number one test status after losing the test series against England 2-1.""I am honoured to have been asked to captain the Test team into a new era,"" the 31-year-old said in a CSA statement.""I thoroughly enjoyed captaining in the last two Tests against England and although I still have a lot to learn in this role it´s a new challenge that I´m excited to take on.""I believe we are witnessing the emergence of another great team.<br/> There is plenty of hard work ahead of us; we are rebuilding and have a long way to go to being a finished product as a squad.""De Villiers had expressed doubts about his Test future during the England series, refusing to commit himself to the team beyond this month.He was one of seven players handed two-year contracts on Friday following a board meeting of CSA.The others were batsmen Amla, JP Duminy and Faf du Plessis, and bowlers Morne Morkel, Dale Steyn and Vernon Philander.Temba Bavuma, Farhaan Behardien and Rilee Rossouw were all awarded one-year national contracts for the first time.South Africa´s next Test series is at home to New Zealand in August. (Reuters) ",1/29/2016,De Villiers appointed South Africa Test captai,sports
